id,submission_time,view_number,vote_number,title,message,image
1,1493368154,40,7,"How to make lists in Python? I am totally new to this, any hints?",No message,
2,1493068124,18,9,Wordpress loading multiple jQuery Versions.," ""I developed a plugin that uses the jquery booklet plugin (http://builtbywill.com/booklet/#/) this plugin binds a function to $ so I cann call $('.myBook').booklet(); I could easy managing the loading order with wp_enqueue_script so first I load jquery then I load booklet so everything is fine. BUT in my theme i also using jquery via webpack so the loading order is now following: jquery booklet app.js (bundled file with webpack including jquery)""",
3,1493015432,1371,57,Drawing canvas with an image picked with Cordova Camera Plugin," ""I'm getting an image from device and drawing a canvas with filters using Pixi JS. It works all well using computer to get an image. But when I'm on IOS it throws errors such as cross origin issue or that I'm trying to use an unknown format. This is the code I'm using to draw the image (that works on web/desktop but not cordova built ios app)""",
4,1650626940,2,0,Images,images ,/uploads/1638813983921.jpg
5,1650627144,1,0,Question w/o image,no image,
